[
  {
    "candidate_id": "cand-tech-ai-01",
    "handle": "@tech_ai_persian",
    "title": "هوش مصنوعی و یادگیری عمیق به زبان فارسی",
    "description": "پوشش جدیدترین دستاوردهای هوش مصنوعی، مدل‌های زبانی متن‌باز و ابزارهای توسعه‌دهندگان.",
    "category": "ai_tech",
    "primary_language": "fa",
    "feed_url": "https://t.me/s/tech_ai_persian",
    "poll_interval_minutes": 60,
    "operational_endpoint": {
      "protocol": "https",
      "target": "https://t.me/s/tech_ai_persian",
      "expected_status": 200,
      "timeout_seconds": 3.0
    },
    "sample_messages": [
      {
        "message_id": 101,
        "channel_id": "@tech_ai_persian",
        "timestamp": "2026-10-22T19:30:00Z",
        "content_type": "text",
        "text": "بررسی معماری جدید Mixture-of-Experts در مدل‌های بینایی-زبانی: کاهش سربار محاسباتی و بهبود دقت بازشناسی الگوهای متنی فارسی.",
        "views": 1840,
        "forwards": 42,
        "is_forward": false,
        "forward_from": null,
        "language": "fa",
        "has_links": false,
        "links": [],
        "tags": ["#AI", "#MoE", "#MachineLearning"]
      },
      {
        "message_id": 102,
        "channel_id": "@tech_ai_persian",
        "timestamp": "2026-10-22T08:15:00Z",
        "content_type": "text",
        "text": "مقایسه عملکرد بهینه‌سازی کوانتیزاسیون ۴ بیتی AWQ و GPTQ برای اجرا روی گرافیک‌های نسل جدید.",
        "views": 2150,
        "forwards": 65,
        "is_forward": false,
        "forward_from": null,
        "language": "fa",
        "has_links": false,
        "links": [],
        "tags": ["#Quantization", "#LLM"]
      },
      {
        "message_id": 103,
        "channel_id": "@tech_ai_persian",
        "timestamp": "2026-10-21T16:45:00Z",
        "content_type": "document",
        "text": "دفترچه آموزشی پیاده‌سازی گام‌به‌گام عامل‌های هوشمند با استفاده از پروتکل ابزار و فانکشن کالینگ.",
        "views": 1920,
        "forwards": 88,
        "is_forward": false,
        "forward_from": null,
        "language": "fa",
        "has_links": false,
        "links": [],
        "tags": ["#Agents", "#Tutorial"],
        "media_metadata": {
          "file_size_bytes": 452010,
          "mime_type": "application/pdf"
        }
      },
      {
        "message_id": 104,
        "channel_id": "@tech_ai_persian",
        "timestamp": "2026-10-20T14:10:00Z",
        "content_type": "text",
        "text": "انتشار بنچ‌مارک ارزیابی مهندسی کد و خطایابی خودکار در پروژه‌های پایتون.",
        "views": 1670,
        "forwards": 31,
        "is_forward": false,
        "forward_from": null,
        "language": "fa",
        "has_links": false,
        "links": [],
        "tags": ["#Benchmark", "#Python"]
      },
      {
        "message_id": 105,
        "channel_id": "@tech_ai_persian",
        "timestamp": "2026-10-19T11:00:00Z",
        "content_type": "text",
        "text": "تحلیل تکنیک‌های Fine-Tuning کارآمد نظیر LoRA و DoRA برای آموزش سریع بر روی دادگان محلی.",
        "views": 2300,
        "forwards": 79,
        "is_forward": false,
        "forward_from": null,
        "language": "fa",
        "has_links": false,
        "links": [],
        "tags": ["#FineTuning", "#LoRA"]
      }
    ]
  },
  {
    "candidate_id": "cand-gamedev-godot-02",
    "handle": "@godot_gamecraft_fa",
    "title": "توسعه بازی با گودو و گرافیک سه‌بعدی",
    "description": "مرجع تخصصی موتور بازی‌سازی گودو، شیدرهای سه‌بعدی و معماری صحنه در بازی‌های مستقل ایرانی.",
    "category": "game_development",
    "primary_language": "fa",
    "feed_url": "https://t.me/s/godot_gamecraft_fa",
    "poll_interval_minutes": 120,
    "operational_endpoint": {
      "protocol": "https",
      "target": "https://t.me/s/godot_gamecraft_fa",
      "expected_status": 200,
      "timeout_seconds": 3.0
    },
    "sample_messages": [
      {
        "message_id": 201,
        "channel_id": "@godot_gamecraft_fa",
        "timestamp": "2026-10-22T21:00:00Z",
        "content_type": "text",
        "text": "نحوه بهینه‌سازی ماژول Interaction در موتور Godot 4.3 برای تشخیص اهداف فوکوس‌شده بدون افت نرخ فریم در صحنه‌های شلوغ.",
        "views": 1420,
        "forwards": 29,
        "is_forward": false,
        "forward_from": null,
        "language": "fa",
        "has_links": false,
        "links": [],
        "tags": ["#Godot", "#GameDev", "#Optimization"]
      },
      {
        "message_id": 202,
        "channel_id": "@godot_gamecraft_fa",
        "timestamp": "2026-10-21T18:30:00Z",
        "content_type": "photo",
        "text": "تنظیمات شیدر بازتاب نور محیطی (Ambience Lighting) و محاسبه بردار سایه در فضاهای شهری تیره.",
        "views": 1580,
        "forwards": 38,
        "is_forward": false,
        "forward_from": null,
        "language": "fa",
        "has_links": false,
        "links": [],
        "tags": ["#Shaders", "#Visuals"]
      },
      {
        "message_id": 203,
        "channel_id": "@godot_gamecraft_fa",
        "timestamp": "2026-10-20T12:00:00Z",
        "content_type": "text",
        "text": "کد نمونه برای مدیریت وضعیت‌های متحرک‌سازی شخصیت با استفاده از AnimationTree و اسکریپت GDScript.",
        "views": 1290,
        "forwards": 22,
        "is_forward": false,
        "forward_from": null,
        "language": "fa",
        "has_links": false,
        "links": [],
        "tags": ["#GDScript", "#Animation"]
      },
      {
        "message_id": 204,
        "channel_id": "@godot_gamecraft_fa",
        "timestamp": "2026-10-18T15:20:00Z",
        "content_type": "text",
        "text": "راهنمای تست هدلس (Headless Unit Tests) برای کامپوننت‌های منطقی بازی پیش از خروجی بیلد نهایی.",
        "views": 1110,
        "forwards": 19,
        "is_forward": false,
        "forward_from": null,
        "language": "fa",
        "has_links": false,
        "links": [],
        "tags": ["#QA", "#Testing"]
      }
    ]
  },
  {
    "candidate_id": "cand-automation-cloud-03",
    "handle": "@devops_automation_pro",
    "title": "اتوماسیون زیرساخت و جریان‌های کاری مدرن",
    "description": "تجربیات فنی پیرامون گیت‌هاب اکشنز، سیستم‌های پایپ‌لاین ایونت‌محور، وب‌هوک‌ها و ابزارهای نوین.",
    "category": "automation_devops",
    "primary_language": "fa",
    "feed_url": "https://t.me/s/devops_automation_pro",
    "poll_interval_minutes": 180,
    "operational_endpoint": {
      "protocol": "https",
      "target": "https://t.me/s/devops_automation_pro",
      "expected_status": 200,
      "timeout_seconds": 3.0
    },
    "sample_messages": [
      {
        "message_id": 301,
        "channel_id": "@devops_automation_pro",
        "timestamp": "2026-10-22T17:10:00Z",
        "content_type": "text",
        "text": "معماری رانرهای سلف‌هاستد در مقابل GitHub-hosted: الگوهای مدیریت سهمیه محاسباتی و پایش سلامت ورک‌فلوها.",
        "views": 1780,
        "forwards": 51,
        "is_forward": false,
        "forward_from": null,
        "language": "fa",
        "has_links": false,
        "links": [],
        "tags": ["#DevOps", "#GitHubActions"]
      },
      {
        "message_id": 302,
        "channel_id": "@devops_automation_pro",
        "timestamp": "2026-10-21T10:40:00Z",
        "content_type": "text",
        "text": "طراحی سیستم‌های تحویل رویداد بدون تاخیر با استفاده از نودهای وب‌هوک امن و هدر اعتبارسنجی.",
        "views": 1640,
        "forwards": 44,
        "is_forward": false,
        "forward_from": null,
        "language": "fa",
        "has_links": false,
        "links": [],
        "tags": ["#EventDriven", "#Webhooks"]
      },
      {
        "message_id": 303,
        "channel_id": "@devops_automation_pro",
        "timestamp": "2026-10-19T20:15:00Z",
        "content_type": "text",
        "text": "پروتکل مدیریت سکرت‌ها و توکن‌های دسترسی چندحسابه برای پیشگیری از نشت اطلاعات در لاگ‌های بیلد.",
        "views": 2050,
        "forwards": 72,
        "is_forward": false,
        "forward_from": null,
        "language": "fa",
        "has_links": false,
        "links": [],
        "tags": ["#Security", "#Secrets"]
      }
    ]
  },
  {
    "candidate_id": "cand-narrative-sound-07",
    "handle": "@ambient_soundscapes_fa",
    "title": "صداپیشگی، افکت صوتی و روایت صوتی",
    "description": "تولید و گردآوری قطعات آمبیانس، صدای محیطی و روایت صوتی بازی‌ها.",
    "category": "narrative_audio",
    "primary_language": "fa",
    "feed_url": "https://t.me/s/ambient_soundscapes_fa",
    "poll_interval_minutes": 360,
    "operational_endpoint": {
      "protocol": "https",
      "target": "https://t.me/s/ambient_soundscapes_fa",
      "expected_status": 200,
      "timeout_seconds": 3.0
    },
    "sample_messages": [
      {
        "message_id": 701,
        "channel_id": "@ambient_soundscapes_fa",
        "timestamp": "2026-10-21T14:00:00Z",
        "content_type": "audio",
        "text": "بسته صوتی نویز باران و صدای باد در کوچه‌های سنگفرش شبانه؛ مناسب برای لایه اتمسفر پس‌زمینه.",
        "views": 850,
        "forwards": 24,
        "is_forward": false,
        "forward_from": null,
        "language": "fa",
        "has_links": false,
        "links": [],
        "tags": ["#Ambience", "#Foley", "#AudioDesign"],
        "media_metadata": {
          "file_size_bytes": 3200100,
          "duration_seconds": 124.5,
          "mime_type": "audio/ogg"
        }
      },
      {
        "message_id": 702,
        "channel_id": "@ambient_soundscapes_fa",
        "timestamp": "2026-10-09T18:00:00Z",
        "content_type": "audio",
        "text": "نمونه ضبط صدای قدم زدن روی آسفالت خیس با میکروفون شات‌گان دوگانه.",
        "views": 920,
        "forwards": 31,
        "is_forward": false,
        "forward_from": null,
        "language": "fa",
        "has_links": false,
        "links": [],
        "tags": ["#SoundEffects", "#GameAudio"],
        "media_metadata": {
          "file_size_bytes": 1800240,
          "duration_seconds": 45.0,
          "mime_type": "audio/ogg"
        }
      }
    ]
  }
]
